
    =========================== USB Port1 ===========================

Connection Status        : 0x01 (Device is connected)
Port Chain               : 3-1

      ======================== USB Device ========================

        +++++++++++++++++ Device Information ++++++++++++++++++
Device Description       : USB Composite Device
Device Path              : \\?\usb#vid_04d8&pid_0064#5&34795c37&0&1#{a5dcbf10-6530-11d2-901f-00c04fb951ed}
Device ID                : USB\VID_04D8&PID_0064\5&34795C37&0&1
Hardware IDs             : USB\VID_04D8&PID_0064&REV_0100 USB\VID_04D8&PID_0064
Driver KeyName           : {36fc9e60-c465-11cf-8056-444553540000}\0082 (GUID_DEVCLASS_USB)
Driver                   : system32\DRIVERS\usbccgp.sys (Version: 6.1.7601.24138  Date: 2018-05-02)
Driver Inf               : C:\windows\inf\usb.inf
Legacy BusType           : PNPBus
Class                    : USB
Class GUID               : {36fc9e60-c465-11cf-8056-444553540000} (GUID_DEVCLASS_USB)
Interface GUID           : {a5dcbf10-6530-11d2-901f-00c04fb951ed} (GUID_DEVINTERFACE_USB_DEVICE)
Service                  : usbccgp
Enumerator               : USB
Location Info            : Port_#0001.Hub_#0001
Location IDs             : PCIROOT(0)#PCI(1400)#USBROOT(0)#USB(1)
Container ID             : {454c93fc-75ad-11e9-9c74-5cc5d413a7c1}
Manufacturer Info        : (Standard USB Host Controller)
Capabilities             : 0x84 (Removable, SurpriseRemovalOK)
Status                   : 0x0180600A (DN_DRIVER_LOADED, DN_STARTED, DN_DISABLEABLE, DN_REMOVABLE, DN_NT_ENUMERATOR, DN_NT_DRIVER)
Problem Code             : 0
Address                  : 1
Power State              : D0 (supported: D0, D3, wake from D0)
 Child Device 1          : Harmony USB Speaker Example (USB Audio Device)
  DevicePath             : \\?\usb#vid_04d8&pid_0064&mi_00#6&18a532a4&1&0000#{6994ad04-93ef-11d0-a3cc-00a0c9223196}\global
  KernelName             : \Device\0000011e\global
  Device ID              : USB\VID_04D8&PID_0064&MI_00\6&18A532A4&1&0000
  Class                  : MEDIA

        +++++++++++++++++ Registry USB Flags +++++++++++++++++
HKEY_LOCAL_MACHINE\SYSTEM\CurrentControlSet\Control\UsbFlags\04D800640100
 osvc                    : REG_BINARY 00 00
 SkipContainerIdQuery    : REG_BINARY 01 00 00 00

        ---------------- Connection Information ---------------
Connection Index         : 0x01 (1)
Connection Status        : 0x01 (DeviceConnected)
Current Config Value     : 0x01
Device Address           : 0x08 (8)
Is Hub                   : 0x00 (no)
Number Of Open Pipes     : 0x00 (0)
Device Bus Speed         : 0x01 (Full-Speed)
Data (HexDump)           : 01 00 00 00 12 01 00 02 00 00 00 40 D8 04 64 00   ...........@..d.
                           00 01 01 02 00 01 01 01 00 08 00 00 00 00 00 01   ................
                           00 00 00                                          ...

    ---------------------- Device Descriptor ----------------------
bLength                  : 0x12 (18 bytes)
bDescriptorType          : 0x01 (Device Descriptor)
bcdUSB                   : 0x200 (USB Version 2.00)
bDeviceClass             : 0x00 (defined by the interface descriptors)
bDeviceSubClass          : 0x00
bDeviceProtocol          : 0x00
bMaxPacketSize0          : 0x40 (64 bytes)
idVendor                 : 0x04D8 (Microchip Technology Inc.)
idProduct                : 0x0064
bcdDevice                : 0x0100
iManufacturer            : 0x01 (String Descriptor 1)
 Language 0x0409         : "Microchip Technology Inc."
iProduct                 : 0x02 (String Descriptor 2)
 Language 0x0409         : "Harmony USB Speaker Example"
iSerialNumber            : 0x00 (No String Descriptor)
bNumConfigurations       : 0x01 (1 Configuration)
Data (HexDump)           : 12 01 00 02 00 00 00 40 D8 04 64 00 00 01 01 02   .......@..d.....
                           00 01                                             ..

    ------------------ Configuration Descriptor -------------------
bLength                  : 0x09 (9 bytes)
bDescriptorType          : 0x02 (Configuration Descriptor)
wTotalLength             : 0x006E (110 bytes)
bNumInterfaces           : 0x02 (2 Interfaces)
bConfigurationValue      : 0x01 (Configuration 1)
iConfiguration           : 0x00 (No String Descriptor)
bmAttributes             : 0xC0
 D7: Reserved, set 1     : 0x01
 D6: Self Powered        : 0x01 (yes)
 D5: Remote Wakeup       : 0x00 (no)
 D4..0: Reserved, set 0  : 0x00
MaxPower                 : 0x32 (100 mA)
Data (HexDump)           : 09 02 6E 00 02 01 00 C0 32 09 04 00 00 00 01 01   ..n.....2.......
                           00 00 09 24 01 00 01 28 00 01 01 0C 24 02 01 01   ...$...(....$...
                           01 00 02 03 00 00 00 0A 24 06 05 01 01 01 00 00   ........$.......
                           00 09 24 03 02 01 03 00 05 00 09 04 01 00 00 01   ..$.............
                           02 00 00 09 04 01 01 01 01 02 00 00 07 24 01 01   .............$..
                           01 01 00 0B 24 02 01 02 02 10 01 80 BB 00 09 05   ....$...........
                           01 09 C0 00 01 00 00 07 25 01 00 00 00 00         ........%.....

        ---------------- Interface Descriptor -----------------
bLength                  : 0x09 (9 bytes)
bDescriptorType          : 0x04 (Interface Descriptor)
bInterfaceNumber         : 0x00
bAlternateSetting        : 0x00
bNumEndpoints            : 0x00 (Default Control Pipe only)
bInterfaceClass          : 0x01 (Audio)
bInterfaceSubClass       : 0x01 (Audio Control)
bInterfaceProtocol       : 0x00
iInterface               : 0x00 (No String Descriptor)
Data (HexDump)           : 09 04 00 00 00 01 01 00 00                        .........

        ------ Audio Control Interface Header Descriptor ------
bLength                  : 0x09 (9 bytes)
bDescriptorType          : 0x24 (Audio Interface Descriptor)
bDescriptorSubtype       : 0x01 (Header)
bcdADC                   : 0x0100
wTotalLength             : 0x0028 (40 bytes)
bInCollection            : 0x01
baInterfaceNr[1]         : 0x01
Data (HexDump)           : 09 24 01 00 01 28 00 01 01                        .$...(...

        ------- Audio Control Input Terminal Descriptor -------
bLength                  : 0x0C (12 bytes)
bDescriptorType          : 0x24 (Audio Interface Descriptor)
bDescriptorSubtype       : 0x02 (Input Terminal)
bTerminalID              : 0x01
wTerminalType            : 0x0101 (USB streaming)
bAssocTerminal           : 0x00
bNrChannels              : 0x02
wChannelConfig           : 0x0003
iChannelNames            : 0x00 (No String Descriptor)
iTerminal                : 0x00 (No String Descriptor)
Data (HexDump)           : 0C 24 02 01 01 01 00 02 03 00 00 00               .$..........

        -------- Audio Control Feature Unit Descriptor --------
bLength                  : 0x0A (10 bytes)
bDescriptorType          : 0x24 (Audio Interface Descriptor)
bDescriptorSubtype       : 0x06 (Feature Unit)
bUnitID                  : 0x05 (5)
bSourceID                : 0x01 (1)
bControlSize             : 0x01 (1 byte per control)
bmaControls[0]           : 0x01
 D0: Mute                : 1 (yes)
 D1: Volume              : 0 (no)
 D2: Bass                : 0 (no)
 D3: Mid                 : 0 (no)
 D4: Treble              : 0 (no)
 D5: Graphic Equalizer   : 0 (no)
 D6: Automatic Gain      : 0 (no)
 D7: Delay               : 0 (no)
bmaControls[1]           : 0x00
 D0: Mute                : 0 (no)
 D1: Volume              : 0 (no)
 D2: Bass                : 0 (no)
 D3: Mid                 : 0 (no)
 D4: Treble              : 0 (no)
 D5: Graphic Equalizer   : 0 (no)
 D6: Automatic Gain      : 0 (no)
 D7: Delay               : 0 (no)
bmaControls[2]           : 0x00
 D0: Mute                : 0 (no)
 D1: Volume              : 0 (no)
 D2: Bass                : 0 (no)
 D3: Mid                 : 0 (no)
 D4: Treble              : 0 (no)
 D5: Graphic Equalizer   : 0 (no)
 D6: Automatic Gain      : 0 (no)
 D7: Delay               : 0 (no)
iFeature                 : 0x00 (No String Descriptor)
Data (HexDump)           : 0A 24 06 05 01 01 01 00 00 00                     .$........

        ------- Audio Control Output Terminal Descriptor ------
bLength                  : 0x09 (9 bytes)
bDescriptorType          : 0x24 (Audio Interface Descriptor)
bDescriptorSubtype       : 0x03 (Output Terminal)
bTerminalID              : 0x02
wTerminalType            : 0x0301 (Speaker)
bAssocTerminal           : 0x00 (0)
bSourceID                : 0x05 (5)
iTerminal                : 0x00 (No String Descriptor)
Data (HexDump)           : 09 24 03 02 01 03 00 05 00                        .$.......

        ---------------- Interface Descriptor -----------------
bLength                  : 0x09 (9 bytes)
bDescriptorType          : 0x04 (Interface Descriptor)
bInterfaceNumber         : 0x01
bAlternateSetting        : 0x00
bNumEndpoints            : 0x00 (Default Control Pipe only)
bInterfaceClass          : 0x01 (Audio)
bInterfaceSubClass       : 0x02 (Audio Streaming)
bInterfaceProtocol       : 0x00
iInterface               : 0x00 (No String Descriptor)
Data (HexDump)           : 09 04 01 00 00 01 02 00 00                        .........

        ---------------- Interface Descriptor -----------------
bLength                  : 0x09 (9 bytes)
bDescriptorType          : 0x04 (Interface Descriptor)
bInterfaceNumber         : 0x01
bAlternateSetting        : 0x01
bNumEndpoints            : 0x01 (1 Endpoint)
bInterfaceClass          : 0x01 (Audio)
bInterfaceSubClass       : 0x02 (Audio Streaming)
bInterfaceProtocol       : 0x00
iInterface               : 0x00 (No String Descriptor)
Data (HexDump)           : 09 04 01 01 01 01 02 00 00                        .........

        -------- Audio Streaming Interface Descriptor ---------
bLength                  : 0x07 (7 bytes)
bDescriptorType          : 0x24 (Audio Interface Descriptor)
bDescriptorSubtype       : 0x01
bTerminalLink            : 0x01
bDelay                   : 0x01
wFormatTag               : 0x0001 (PCM)
Data (HexDump)           : 07 24 01 01 01 01 00                              .$.....

        ------- Audio Streaming Format Type Descriptor --------
bLength                  : 0x0B (11 bytes)
bDescriptorType          : 0x24 (Audio Interface Descriptor)
bDescriptorSubtype       : 0x02 (Format Type)
bFormatType              : 0x01
bNrChannels              : 0x02 (2 channels)
bSubframeSize            : 0x02 (2 bytes per subframe)
bBitResolution           : 0x10 (16 bits per sample)
bSamFreqType             : 0x01 (supports 1 sample frequence)
tSamFreq[1]              : 0x0BB80 (48000 Hz)
Data (HexDump)           : 0B 24 02 01 02 02 10 01 80 BB 00                  .$.........

        ----------------- Endpoint Descriptor -----------------
bLength                  : 0x09 (9 bytes)
bDescriptorType          : 0x05 (Endpoint Descriptor)
bEndpointAddress         : 0x01 (Direction=OUT EndpointID=1)
bmAttributes             : 0x09 (TransferType=Isochronous  SyncType=Adaptive  EndpointType=Data)
wMaxPacketSize           : 0x00C0 (192 bytes)
bInterval                : 0x01 (1 ms)
bRefresh                 : 0x00
bSynchAddress            : 0x00
Data (HexDump)           : 09 05 01 09 C0 00 01 00 00                        .........

        ----------- Audio Data Endpoint Descriptor ------------
bLength                  : 0x07 (7 bytes)
bDescriptorType          : 0x25 (Audio Endpoint Descriptor)
bDescriptorSubtype       : 0x01 (General)
bmAttributes             : 0x00
bLockDelayUnits          : 0x00
wLockDelay               : 0x0000
Data (HexDump)           : 07 25 01 00 00 00 00                              .%.....

    ----------------- Device Qualifier Descriptor -----------------
Error                    : ERROR_GEN_FAILURE

      -------------------- String Descriptors -------------------
             ------ String Descriptor 0 ------
bLength                  : 0x04 (4 bytes)
bDescriptorType          : 0x03 (String Descriptor)
Language ID[0]           : 0x0409 (English - United States)
Data (HexDump)           : 04 03 09 04                                       ....
             ------ String Descriptor 1 ------
bLength                  : 0x34 (52 bytes)
bDescriptorType          : 0x03 (String Descriptor)
Language 0x0409          : "Microchip Technology Inc."
Data (HexDump)           : 34 03 4D 00 69 00 63 00 72 00 6F 00 63 00 68 00   4.M.i.c.r.o.c.h.
                           69 00 70 00 20 00 54 00 65 00 63 00 68 00 6E 00   i.p. .T.e.c.h.n.
                           6F 00 6C 00 6F 00 67 00 79 00 20 00 49 00 6E 00   o.l.o.g.y. .I.n.
                           63 00 2E 00                                       c...
             ------ String Descriptor 2 ------
bLength                  : 0x38 (56 bytes)
bDescriptorType          : 0x03 (String Descriptor)
Language 0x0409          : "Harmony USB Speaker Example"
Data (HexDump)           : 38 03 48 00 61 00 72 00 6D 00 6F 00 6E 00 79 00   8.H.a.r.m.o.n.y.
                           20 00 55 00 53 00 42 00 20 00 53 00 70 00 65 00    .U.S.B. .S.p.e.
                           61 00 6B 00 65 00 72 00 20 00 45 00 78 00 61 00   a.k.e.r. .E.x.a.
                           6D 00 70 00 6C 00 65 00                           m.p.l.e.

